{"$schema":"https://json-schema.org/draft/2020-12/schema","title":"WTS SmartScore Reviewed Batch","type":"object","required":["batch_id","sheet_id","items","official_result_write"],"properties":{"batch_id":{"type":"string"},"sheet_id":{"type":"string"},"official_result_write":{"const":false},"items":{"type":"array","items":{"type":"object","required":["student_id","assessment_id","state","confidence"],"properties":{"student_id":{"type":"string"},"assessment_id":{"type":"string"},"raw_value":{"type":["number","null"]},"reviewed_value":{"type":["number","null"]},"confidence":{"type":"number","minimum":0,"maximum":1},"state":{"enum":["CONFIRMED","REVIEW_REQUIRED","INVALID","BLANK","UNREADABLE","MANUALLY_CORRECTED"]}}}}}}
