{"batch_id":"LOCAL-DEMO-001","sheet_id":"WTS-SMARTSCORE-DEMO-0001","official_result_write":false,"items":[{"student_id":"TEST-STU-001","student_name":"Test Student 01","assessment_id":"ca1","raw_value":8,"reviewed_value":8,"confidence":0.97,"state":"CONFIRMED"},{"student_id":"TEST-STU-002","student_name":"Test Student 02","assessment_id":"ca2","raw_value":7,"reviewed_value":9,"confidence":0.63,"state":"MANUALLY_CORRECTED"}]}
